{
  "schemaVersion": 1,
  "cellId": "CODEX-ROUTING-LINUX-UNEXECUTED-2f0ae201",
  "status": "not_executed_host_owned",
  "buildIdentity": "sha256:2f0ae201bc742ecc00f45b98d0930a2aed368eb4b22b5582431960fa08783ac1",
  "componentDigests": {
    "compatibilityManifest": "sha256:0b6941163dd94ee2bc5d5d3282fd6225714c459aabb97d986429e2280eacc6f9",
    "runtime": "sha256:57dce15d2249c33de5a33e35bc6d98a5e0b8a0a92c997f6bee3d39457e4a5eca",
    "operationSchema": "sha256:549be132ac488354829b6195caf43f6596c6dd4c6c2ad8b2e8999238911bd4fa",
    "skill": "sha256:ed9e562905020382bcc2758424d53b28da668ac760a5bd3ea95f9bd0948a3581",
    "codexHostMetadata": "sha256:cc1c9a0b820f9c75c93dcc48efafb3f52dba3bffd7a7f92a37ce11207e5f07ed",
    "evidenceSchema": "sha256:ba65cea6f9d1c21feb64d7022e0d99c83e90390d91b9a0056bd0bcca5be9c192"
  },
  "surface": {
    "kind": "codex_plugin",
    "operations": [
      "capabilities.get",
      "task.list"
    ]
  },
  "host": {
    "kind": "codex",
    "versions": {
      "codex": "unobserved"
    },
    "scope": "user"
  },
  "platform": {
    "os": "linux",
    "version": null,
    "build": null,
    "architecture": null,
    "distribution": null
  },
  "runtime": {
    "nodeExecutable": null,
    "nodeVersion": null
  },
  "scenario": {
    "id": "CODEX-INSTALL-ROUTING",
    "family": "codex-install-routing",
    "description": "Native linux Codex host cell reserved for the same generated candidate; no executor/host version was observed in this task."
  },
  "fixture": {
    "digest": "sha256:afe66801217dad8650dd8c2b8d105a638dc75ef3f1d77370f36d6f93329587d2",
    "harnessDigest": "sha256:8e0a1a0b469be547cb5f276091febd124e79c6c27acc636d89c3de8b26ebb6d2"
  },
  "execution": {
    "startedAt": null,
    "completedAt": null,
    "actions": [],
    "commands": []
  },
  "result": {
    "code": "native_codex_host_not_executed",
    "summary": "No native linux Codex host execution was available; no install, routing, lifecycle, update, disable, uninstall, or takeover readiness is claimed.",
    "assertions": [
      {
        "id": "native-host-cell",
        "status": "not_executed",
        "evidenceRefs": []
      }
    ]
  },
  "evidence": {
    "rawRefs": []
  },
  "invalidation": {
    "state": "current",
    "checkedAt": "2026-07-20T10:50:00.000Z",
    "invalidatedAt": null,
    "reasons": [],
    "keys": {
      "buildIdentity": "sha256:2f0ae201bc742ecc00f45b98d0930a2aed368eb4b22b5582431960fa08783ac1",
      "evidenceSchemaVersion": 1,
      "hostVersions": {
        "codex": "unobserved"
      },
      "os": "linux",
      "osVersion": null,
      "osBuild": null,
      "architecture": null,
      "nodeVersion": null,
      "fixtureDigest": "sha256:afe66801217dad8650dd8c2b8d105a638dc75ef3f1d77370f36d6f93329587d2",
      "harnessDigest": "sha256:8e0a1a0b469be547cb5f276091febd124e79c6c27acc636d89c3de8b26ebb6d2"
    }
  }
}
