{
  "schemaVersion": 1,
  "cellId": "CORE-CLI-MCP-LINUX-DEBIAN12-6.6.87.2-x64-c9f8ef1e",
  "status": "passed",
  "buildIdentity": "sha256:c9f8ef1ee494f3007ee365dc67e94bc21226610e2ec3e5f380dd05593c09cb5d",
  "componentDigests": {
    "compatibilityManifest": "sha256:285796db2fa242a103cced129e2751c03c6efbb157016d23a6dd5595584803e7",
    "runtime": "sha256:57dce15d2249c33de5a33e35bc6d98a5e0b8a0a92c997f6bee3d39457e4a5eca",
    "operationSchema": "sha256:549be132ac488354829b6195caf43f6596c6dd4c6c2ad8b2e8999238911bd4fa",
    "skill": "sha256:ed9e562905020382bcc2758424d53b28da668ac760a5bd3ea95f9bd0948a3581",
    "evidenceSchema": "sha256:ba65cea6f9d1c21feb64d7022e0d99c83e90390d91b9a0056bd0bcca5be9c192"
  },
  "surface": { "kind": "cli_mcp", "operations": ["capabilities.get", "project.inspect", "adoption.inspect", "task.start", "task.stop", "clean.plan", "clean.applySafe"] },
  "host": { "kind": "standalone", "versions": {}, "scope": "standalone" },
  "platform": { "os": "linux", "version": "12", "build": "6.6.87.2-microsoft-standard-WSL2", "architecture": "x64", "distribution": "Debian GNU/Linux" },
  "runtime": { "nodeExecutable": "/usr/local/bin/node", "nodeVersion": "20.20.2" },
  "scenario": { "id": "CORE-CLI-MCP-EQUIVALENCE", "family": "core-stdio-bundle", "description": "Linux CLI/MCP reuse, concurrency, ownership refusal, clean drift refusal, and adoption zero-write behavior." },
  "fixture": { "digest": "sha256:9dcbd164b90fb2aa27112411d65c6c2b740c6d8730e64fb2a16c977d20ffa305", "harnessDigest": "sha256:b7077fd89863c4e9c877a94839d081fdab83f1debd36ce1c9b60b457381255ef" },
  "execution": {
    "startedAt": "2026-07-20T10:18:00.000Z", "completedAt": "2026-07-20T10:23:53.026Z",
    "actions": ["run in minimal Node 20 container", "observe missing listener utility failure", "install iproute2 6.1.0-3", "rerun original cell", "retain recovery receipt"],
    "commands": ["docker exec launchdeck-linux-evidence node --test --test-concurrency=1 test/e2e/agent-surface-us1.test.js"]
  },
  "result": {
    "code": "passed_after_environment_recovery",
    "summary": "The original cell passed 5/5 after the exact Linux environment gained the ss listener utility; the initial 4/5 failure is retained.",
    "assertions": [
      { "id": "one-run-one-spawn", "status": "passed", "evidenceRefs": ["core-state", "core-process"] },
      { "id": "ownership-and-clean-refusal", "status": "passed", "evidenceRefs": ["core-command"] },
      { "id": "adoption-zero-write", "status": "passed", "evidenceRefs": ["core-state"] }
    ]
  },
  "evidence": { "rawRefs": [
    { "id": "core-command", "kind": "command", "path": "raw/core-cli-mcp.tap.txt", "sha256": "171191130145da0d34a413ccf1e58929789091228d756ab74daae6c2e8c562e7" },
    { "id": "core-state", "kind": "state", "path": "raw/core-cli-mcp.tap.txt", "sha256": "171191130145da0d34a413ccf1e58929789091228d756ab74daae6c2e8c562e7" },
    { "id": "core-process", "kind": "process", "path": "raw/core-cli-mcp.tap.txt", "sha256": "171191130145da0d34a413ccf1e58929789091228d756ab74daae6c2e8c562e7" },
    { "id": "platform", "kind": "host", "path": "raw/platform.json", "sha256": "cc8cb2199f8217d76663c420a1f3f4c2bc870c4e2c0590a583e864127a9fcb08" }
  ] },
  "invalidation": {
    "state": "current", "checkedAt": "2026-07-20T10:23:53.026Z", "invalidatedAt": null, "reasons": [],
    "keys": { "buildIdentity": "sha256:c9f8ef1ee494f3007ee365dc67e94bc21226610e2ec3e5f380dd05593c09cb5d", "evidenceSchemaVersion": 1, "hostVersions": {}, "os": "linux", "osVersion": "12", "osBuild": "6.6.87.2-microsoft-standard-WSL2", "architecture": "x64", "nodeVersion": "20.20.2", "fixtureDigest": "sha256:9dcbd164b90fb2aa27112411d65c6c2b740c6d8730e64fb2a16c977d20ffa305", "harnessDigest": "sha256:b7077fd89863c4e9c877a94839d081fdab83f1debd36ce1c9b60b457381255ef" }
  }
}
