{
  "schemaVersion": 1,
  "cellId": "CROSS-HOST-WINDOWS-UNEXECUTED-48cc9c90",
  "status": "not_executed_host_owned",
  "buildIdentity": "sha256:48cc9c90211fb89143da8446b2d7923256ceed07d122c66600df01900eb1c5d1",
  "componentDigests": {
    "compatibilityManifest": "sha256:d732a2a8af67d2ad99a712da7a0d471af142765157700781f89ae48eeb845e90",
    "runtime": "sha256:57dce15d2249c33de5a33e35bc6d98a5e0b8a0a92c997f6bee3d39457e4a5eca",
    "operationSchema": "sha256:549be132ac488354829b6195caf43f6596c6dd4c6c2ad8b2e8999238911bd4fa",
    "skill": "sha256:ed9e562905020382bcc2758424d53b28da668ac760a5bd3ea95f9bd0948a3581",
    "codexHostMetadata": "sha256:cc1c9a0b820f9c75c93dcc48efafb3f52dba3bffd7a7f92a37ce11207e5f07ed",
    "claudeHostMetadata": "sha256:a10a7fcb75e49c4bace133624a66bf6a7e75c3c7e868a2418d9650c667883828",
    "evidenceSchema": "sha256:ba65cea6f9d1c21feb64d7022e0d99c83e90390d91b9a0056bd0bcca5be9c192"
  },
  "surface": {
    "kind": "cross_host",
    "operations": [
      "task.start",
      "task.status",
      "task.stop"
    ]
  },
  "host": {
    "kind": "cross_host",
    "versions": {
      "claude": "2.1.211 (Claude Code)",
      "codex": "0.144.4"
    },
    "scope": "mixed"
  },
  "platform": {
    "os": "windows",
    "version": "10.0.26200.0",
    "build": "26200",
    "architecture": "x64",
    "distribution": null
  },
  "runtime": {
    "nodeExecutable": "C:/nvm4w/nodejs/node.exe",
    "nodeVersion": "v24.14.0"
  },
  "scenario": {
    "id": "CROSS-HOST-INDEPENDENCE",
    "family": "cross-host-lifecycle",
    "description": "Windows Codex and Claude side-by-side lifecycle independence and compatible takeover cell for the generated candidate."
  },
  "fixture": {
    "digest": "sha256:a3f2fc117e26e33c95245a775fcc2259f7760bf342f6180b96721751f9988a53",
    "harnessDigest": "sha256:3df8e8967dc149f2e7108430811b30602ee734ac3542a5c21b5aef95be22342f"
  },
  "execution": {
    "startedAt": null,
    "completedAt": null,
    "actions": [],
    "commands": []
  },
  "result": {
    "code": "upstream_host_lifecycle_not_ready",
    "summary": "Codex 0.144.4 ended the managed child on host exit, and Claude Code 2.1.211 could not dispatch the fixture route because an inherited UserPromptSubmit hook is broken. No side-by-side install/update/disable/uninstall or takeover was executed; no cross-host independence claim is made.",
    "assertions": [
      {
        "id": "side-by-side-host-independence",
        "status": "not_executed",
        "evidenceRefs": []
      },
      {
        "id": "shared-run-takeover",
        "status": "not_executed",
        "evidenceRefs": []
      }
    ]
  },
  "evidence": {
    "rawRefs": []
  },
  "invalidation": {
    "state": "current",
    "checkedAt": "2026-07-20T11:21:55.220Z",
    "invalidatedAt": null,
    "reasons": [],
    "keys": {
      "buildIdentity": "sha256:48cc9c90211fb89143da8446b2d7923256ceed07d122c66600df01900eb1c5d1",
      "evidenceSchemaVersion": 1,
      "hostVersions": {
        "claude": "2.1.211 (Claude Code)",
        "codex": "0.144.4"
      },
      "os": "windows",
      "osVersion": "10.0.26200.0",
      "osBuild": "26200",
      "architecture": "x64",
      "nodeVersion": "v24.14.0",
      "fixtureDigest": "sha256:a3f2fc117e26e33c95245a775fcc2259f7760bf342f6180b96721751f9988a53",
      "harnessDigest": "sha256:3df8e8967dc149f2e7108430811b30602ee734ac3542a5c21b5aef95be22342f"
    }
  }
}
